<?xml version="1.0" encoding="UTF-8"?>
<ONTOLOGY
    xmlns:xsi="http://www.w3.org/2001/XMLSchema-instance"
    xsi:noNamespaceSchemaLocation="file:/Library/WebServer/Library/PHPWrapper/defines/Ontology.xsd">
    
    <!-- Tag object -->
    
    <UNIT>
        <TERM NS="" LID="_tags">
            <element variable="kTAG_LABEL">
                <item key="en">Tag</item>
            </element>
            <element variable="kTAG_DEFINITION">
                <item key="en"><![CDATA[An ontology tag represents the <i>path</i> between an <i>ontology feature vertex</i> and an <i>ontology scale vertex</i>. Tags record the terms referenced by the vertices and the predicates that relate them.]]></item>
            </element>
        </TERM>
        <NODE class="COntologyMasterVertex">
            <element variable="kTAG_CATEGORY">
                <item>Schema</item>
            </element>
        </NODE>
        <EDGE>
            <element variable="kTAG_PREDICATE">:SUBCLASS-OF</element>
            <element variable="kTAG_OBJECT">:ONTOLOGY:OBJECT</element>
        </EDGE>
    </UNIT>
    
	<!-- kTAG_NID -->
    <UNIT>
        <NODE class="COntologyAliasVertex" term=":NID">
            <element variable="kTAG_KIND">
                <item>:KIND-FEATURE</item>
                <item>:KIND-SCALE</item>
            </element>
            <element variable="kTAG_TYPE">
                <item>:INT</item>
                <item>:COMPUTED</item>
                <item>:REQUIRED</item>
            </element>
            <element variable="kTAG_DESCRIPTION">
                <item key="en"><![CDATA[The <i>native identifier</i> of a tag is an <i>integer</i> <i>generated by a sequence</i>. <i>All the attributes in this system are tagged with this attribute</i>, this is why it must be short.]]></item>
            </element>
        </NODE>
        <EDGE>
            <element variable="kTAG_PREDICATE">:ATTRIBUTE-OF</element>
            <element variable="kTAG_OBJECT">:_tags</element>
        </EDGE>
    </UNIT>
     
	<!-- kTAG_GID -->
    <UNIT>
        <NODE class="COntologyAliasVertex" term=":GID">
            <element variable="kTAG_KIND">
                <item>:KIND-FEATURE</item>
                <item>:KIND-SCALE</item>
            </element>
            <element variable="kTAG_TYPE">
                <item>:TEXT</item>
                <item>:LOCKED</item>
                <item>:COMPUTED</item>
                <item>:REQUIRED</item>
            </element>
            <element variable="kTAG_DESCRIPTION">
                <item key="en"><![CDATA[The <i>global identifier</i> of a tag is computed by <i>concatenating</i> the <i>term global identifiers</i> of all the <i>elements of the tag's path</i>, <i>separated by a slash</i>.]]></item>
            </element>
        </NODE>
        <EDGE>
            <element variable="kTAG_PREDICATE">:ATTRIBUTE-OF</element>
            <element variable="kTAG_OBJECT">:_tags</element>
        </EDGE>
    </UNIT>
   
	<!-- kTAG_CLASS -->
    <UNIT>
        <EDGE>
            <element variable="kTAG_SUBJECT">:CLASS</element>
            <element variable="kTAG_PREDICATE">:ATTRIBUTE-OF</element>
            <element variable="kTAG_OBJECT">:_tags</element>
        </EDGE>
    </UNIT>
    
	<!-- kTAG_UID -->
    <UNIT>
        <EDGE>
            <element variable="kTAG_SUBJECT">:UID</element>
            <element variable="kTAG_PREDICATE">:ATTRIBUTE-OF</element>
            <element variable="kTAG_OBJECT">:_tags</element>
        </EDGE>
    </UNIT>
    
	<!-- kTAG_PATH -->
    <UNIT>
        <EDGE>
            <element variable="kTAG_SUBJECT">:PATH</element>
            <element variable="kTAG_PREDICATE">:ATTRIBUTE-OF</element>
            <element variable="kTAG_OBJECT">:_tags</element>
        </EDGE>
    </UNIT>
    
	<!-- kTAG_SYNONYMS -->
    <UNIT>
        <EDGE>
            <element variable="kTAG_SUBJECT">:SYNONYMS</element>
            <element variable="kTAG_PREDICATE">:ATTRIBUTE-OF</element>
            <element variable="kTAG_OBJECT">:_tags</element>
        </EDGE>
    </UNIT>
        
	<!-- kTAG_INPUT -->
    <UNIT>
        <EDGE>
            <element variable="kTAG_SUBJECT">:INPUT</element>
            <element variable="kTAG_PREDICATE">:ATTRIBUTE-OF</element>
            <element variable="kTAG_OBJECT">:_nodes</element>
        </EDGE>
    </UNIT>
        
	<!-- kTAG_PATTERN -->
    <UNIT>
        <EDGE>
            <element variable="kTAG_SUBJECT">:PATTERN</element>
            <element variable="kTAG_PREDICATE">:ATTRIBUTE-OF</element>
            <element variable="kTAG_OBJECT">:_nodes</element>
        </EDGE>
    </UNIT>
        
	<!-- kTAG_LENGTH -->
    <UNIT>
        <EDGE>
            <element variable="kTAG_SUBJECT">:LENGTH</element>
            <element variable="kTAG_PREDICATE">:ATTRIBUTE-OF</element>
            <element variable="kTAG_OBJECT">:_nodes</element>
        </EDGE>
    </UNIT>
        
	<!-- kTAG_MIN_VAL -->
    <UNIT>
        <EDGE>
            <element variable="kTAG_SUBJECT">:MIN-VAL</element>
            <element variable="kTAG_PREDICATE">:ATTRIBUTE-OF</element>
            <element variable="kTAG_OBJECT">:_nodes</element>
        </EDGE>
    </UNIT>
        
	<!-- kTAG_MAX_VAL -->
    <UNIT>
        <EDGE>
            <element variable="kTAG_SUBJECT">:MAX-VAL</element>
            <element variable="kTAG_PREDICATE">:ATTRIBUTE-OF</element>
            <element variable="kTAG_OBJECT">:_nodes</element>
        </EDGE>
    </UNIT>
        
	<!-- kTAG_EXAMPLES -->
    <UNIT>
        <EDGE>
            <element variable="kTAG_SUBJECT">:EXAMPLES</element>
            <element variable="kTAG_PREDICATE">:ATTRIBUTE-OF</element>
            <element variable="kTAG_OBJECT">:_nodes</element>
        </EDGE>
    </UNIT>
</ONTOLOGY>
