<?xml version="1.0" encoding="UTF-8"?>
<ONTOLOGY
    xmlns:xsi="http://www.w3.org/2001/XMLSchema-instance"
    xsi:noNamespaceSchemaLocation="file:/Library/WebServer/Library/PHPWrapper/defines/Ontology.xsd">
    
    <!-- User object -->
    
    <UNIT>
        <TERM NS="" LID="_users">
            <element variable="kTAG_LABEL">
                <item key="en">User</item>
            </element>
            <element variable="kTAG_DEFINITION">
                <item key="en"><![CDATA[Users collect all information specific to the system users.]]></item>
            </element>
        </TERM>
        <NODE class="COntologyMasterVertex">
            <element variable="kTAG_CATEGORY">
                <item>Schema</item>
            </element>
        </NODE>
        <EDGE>
            <element variable="kTAG_PREDICATE">:SUBCLASS-OF</element>
            <element variable="kTAG_OBJECT">:ONTOLOGY:OBJECT</element>
        </EDGE>
    </UNIT>
    
	<!-- kTAG_NID -->
    <UNIT>
        <NODE class="COntologyAliasVertex" term=":NID">
            <element variable="kTAG_PID">:_users.:NID</element>
            <element variable="kTAG_KIND">
                <item>:KIND-FEATURE</item>
                <item>:KIND-SCALE</item>
            </element>
            <element variable="kTAG_TYPE">
                <item>:BINARY</item>
                <item>:COMPUTED</item>
                <item>:REQUIRED</item>
            </element>
            <element variable="kTAG_DESCRIPTION">
                <item key="en"><![CDATA[The <i>native identifier</i> of a user is its <i>global identifier hashed</i> into a binary string.]]></item>
            </element>
        </NODE>
        <EDGE>
            <element variable="kTAG_PREDICATE">:ATTRIBUTE-OF</element>
            <element variable="kTAG_OBJECT">:_users</element>
        </EDGE>
    </UNIT>
    
	<!-- kTAG_GID -->
    <UNIT>
        <NODE class="COntologyAliasVertex" term=":GID">
            <element variable="kTAG_PID">:_users.:GID</element>
            <element variable="kTAG_KIND">
                <item>:KIND-FEATURE</item>
                <item>:KIND-SCALE</item>
            </element>
            <element variable="kTAG_TYPE">
                <item>:TEXT</item>
                <item>:LOCKED</item>
                <item>:COMPUTED</item>
                <item>:REQUIRED</item>
            </element>
            <element variable="kTAG_INPUT">
                <item>:INPUT-TEXT</item>
            </element>
            <element variable="kTAG_DESCRIPTION">
                <item key="en"><![CDATA[CDATA[The <i>global identifier</i> of a user is the user code.]]></item>
            </element>
        </NODE>
        <EDGE>
            <element variable="kTAG_PREDICATE">:ATTRIBUTE-OF</element>
            <element variable="kTAG_OBJECT">:_users</element>
        </EDGE>
    </UNIT>
    
	<!-- kTAG_CLASS -->
    <UNIT>
        <EDGE>
            <element variable="kTAG_SUBJECT">:CLASS</element>
            <element variable="kTAG_PREDICATE">:ATTRIBUTE-OF</element>
            <element variable="kTAG_OBJECT">:_users</element>
        </EDGE>
    </UNIT>
    
	<!-- kTAG_USER_NAME -->
    <UNIT>
        <EDGE>
            <element variable="kTAG_SUBJECT">:USER-NAME</element>
            <element variable="kTAG_PREDICATE">:ATTRIBUTE-OF</element>
            <element variable="kTAG_OBJECT">:_users</element>
        </EDGE>
    </UNIT>
    
	<!-- kTAG_USER_CODE -->
    <UNIT>
        <EDGE>
            <element variable="kTAG_SUBJECT">:USER-CODE</element>
            <element variable="kTAG_PREDICATE">:ATTRIBUTE-OF</element>
            <element variable="kTAG_OBJECT">:_users</element>
        </EDGE>
    </UNIT>
    
	<!-- kTAG_USER_PASS -->
    <UNIT>
        <EDGE>
            <element variable="kTAG_SUBJECT">:USER-PASS</element>
            <element variable="kTAG_PREDICATE">:ATTRIBUTE-OF</element>
            <element variable="kTAG_OBJECT">:_users</element>
        </EDGE>
    </UNIT>
    
	<!-- kTAG_USER_MAIL -->
    <UNIT>
        <EDGE>
            <element variable="kTAG_SUBJECT">:USER-MAIL</element>
            <element variable="kTAG_PREDICATE">:ATTRIBUTE-OF</element>
            <element variable="kTAG_OBJECT">:_users</element>
        </EDGE>
    </UNIT>
    
	<!-- kTAG_USER_ROLE -->
    <UNIT>
        <EDGE>
            <element variable="kTAG_SUBJECT">:USER-ROLE</element>
            <element variable="kTAG_PREDICATE">:ATTRIBUTE-OF</element>
            <element variable="kTAG_OBJECT">:_users</element>
        </EDGE>
    </UNIT>
    
	<!-- kTAG_USER_PROFILE -->
    <UNIT>
        <EDGE>
            <element variable="kTAG_SUBJECT">:USER-PROFILE</element>
            <element variable="kTAG_PREDICATE">:ATTRIBUTE-OF</element>
            <element variable="kTAG_OBJECT">:_users</element>
        </EDGE>
    </UNIT>
    
	<!-- kTAG_USER_MANAGER -->
    <UNIT>
        <EDGE>
            <element variable="kTAG_SUBJECT">:USER-MANAGER</element>
            <element variable="kTAG_PREDICATE">:ATTRIBUTE-OF</element>
            <element variable="kTAG_OBJECT">:_users</element>
        </EDGE>
    </UNIT>
    
	<!-- kTAG_USER_DOMAIN -->
    <UNIT>
        <EDGE>
            <element variable="kTAG_SUBJECT">:USER-DOMAIN</element>
            <element variable="kTAG_PREDICATE">:ATTRIBUTE-OF</element>
            <element variable="kTAG_OBJECT">:_users</element>
        </EDGE>
    </UNIT>
</ONTOLOGY>
