<?xml version="1.0" encoding="utf-8"?>
<ONTOLOGY
    xmlns:xsi="http://www.w3.org/2001/XMLSchema-instance"
    xsi:noNamespaceSchemaLocation="file:/Library/WebServer/Library/PHPWrapper/defines/Ontology.xsd">
    
	<!-- TEST TERM -->
	
	<UNIT>
		<TERM modify="TEST">
			<element variable="kTAG_KIND">
				<item>:KIND-NAMESPACE</item>
				<item>:KIND-PIPPO</item>
			</element>
			<element variable="kTAG_LABEL">
				<item key="en">Test</item>
				<item key="it">Prova</item>
			</element>
		</TERM>
	</UNIT>
</ONTOLOGY>
